{
  "schemaVersion": "1.0",
  "model": {
    "name": "Required area — max of stations (mm units)",
    "description": null,
    "units": {
      "length": "mm",
      "force": "kN",
      "temperature": "C"
    },
    "source": "synthetic",
    "stories": [
      {
        "name": "L1",
        "elevation": 3000.0,
        "height": 3000.0
      }
    ]
  },
  "materials": [
    {
      "name": "C30",
      "type": "Concrete",
      "grade": "C30",
      "fckMPa": 30
    },
    {
      "name": "B500",
      "type": "Rebar",
      "grade": "B500",
      "density": 7850.0,
      "densityUnit": "kg/m3",
      "fyMPa": 500
    }
  ],
  "sections": [
    {
      "name": "B",
      "kind": "Frame",
      "shape": "Rectangle",
      "width": 300.0,
      "depth": 600.0
    }
  ],
  "elements": [
    {
      "id": "B1",
      "name": "B1",
      "type": "Beam",
      "role": "Physical",
      "parentId": null,
      "story": "L1",
      "material": "C30",
      "section": "B",
      "geometry": {
        "kind": "Line",
        "start": {
          "x": 0,
          "y": 0,
          "z": 3000.0
        },
        "end": {
          "x": 6000.0,
          "y": 0,
          "z": 3000.0
        }
      },
      "reinforcement": {
        "source": "RequiredDesignArea",
        "steelMaterial": "B500",
        "components": [
          {
            "type": "RequiredArea",
            "designResultRef": "B1",
            "envelope": "MaxOfStations",
            "includeShear": true,
            "hoopLength": 1760.0,
            "legs": 2
          }
        ]
      },
      "source": {
        "application": "quentra_bench",
        "version": "1.1.0",
        "objectName": "B1",
        "objectGuid": null,
        "apiMethod": null
      }
    }
  ],
  "designResults": [
    {
      "elementId": "B1",
      "resultType": "ConcreteFrameDesign",
      "status": "Current",
      "origin": "simulated",
      "stations": [
        {
          "station": 0.0,
          "topRequiredArea": 1200.0,
          "bottomRequiredArea": 300.0,
          "shearRequiredAreaPerLength": 1.2
        },
        {
          "station": 1500.0,
          "topRequiredArea": 450.0,
          "bottomRequiredArea": 800.0,
          "shearRequiredAreaPerLength": 0.6
        },
        {
          "station": 3000.0,
          "topRequiredArea": 200.0,
          "bottomRequiredArea": 1100.0,
          "shearRequiredAreaPerLength": 0.4
        },
        {
          "station": 4500.0,
          "topRequiredArea": 450.0,
          "bottomRequiredArea": 800.0,
          "shearRequiredAreaPerLength": 0.6
        },
        {
          "station": 6000.0,
          "topRequiredArea": 1200.0,
          "bottomRequiredArea": 300.0,
          "shearRequiredAreaPerLength": 1.2
        }
      ]
    }
  ],
  "warnings": [],
  "provenance": {
    "type": "synthetic_engineering_benchmark",
    "etabs_verified": false,
    "etabs_version": null,
    "generator": "quentra_bench",
    "generatorVersion": "1.1.0",
    "caseId": "RREQ-006",
    "notes": "Hand-designed synthetic benchmark. Not captured from ETABS."
  }
}
